<?xml version="1.0" encoding="UTF-8" ?>
<paper
        xmlns:xsi="http://www.w3.org/2001/XMLSchema-instance"
        xsi:noNamespaceSchemaLocation="xsdSheme.xsd">
    <periodical>
        <title>
            MyTitle
        </title>
        <type>newspaper</type>
        <monthly value="true"/>
        <chars>
            <colored value="true"/>
            <size>15</size>
            <gloss value="true"/>
            <hasIndex value="true"/>
        </chars>
    </periodical>
    <periodical>
        <title>Mytitle1</title>
        <type>booklet</type>
        <monthly value="true"/>
        <chars>
            <colored value="false"/>
            <size>18</size>
            <gloss value="true"/>
            <hasIndex value="false"/>
        </chars>
    </periodical>
    <periodical>
        <title>Mytitle2</title>
        <type>magazine</type>
        <monthly value="true"/>
        <chars>
            <colored value="true"/>
            <size>20</size>
            <gloss value="true"/>
            <hasIndex value="true"/>
        </chars>
    </periodical>


</paper>
